{
  "$schema": "https://json-schema.org/draft/2020-12/schema",
  "$id": "urn:codex:engineering-graph:repository-config:v1",
  "title": "Engineering graph repository policy",
  "type": "object",
  "additionalProperties": false,
  "required": ["schema_version", "repository_id", "compatible_engine", "artifact_roots", "artifact_kinds", "impact_tags", "routes", "node_templates", "specialists", "limits", "required_checks", "role_capabilities", "denied_patterns"],
  "properties": {
    "schema_version": {"const": 1},
    "repository_id": {"$ref": "#/$defs/id"},
    "compatible_engine": {"type": "object", "additionalProperties": false, "required": ["min", "max_exclusive"], "properties": {"min": {"$ref": "#/$defs/version"}, "max_exclusive": {"$ref": "#/$defs/version"}}},
    "artifact_roots": {"type": "object", "additionalProperties": false, "required": ["repo", "profile"], "properties": {"repo": {"$ref": "#/$defs/nonEmptyUniqueStrings"}, "profile": {"$ref": "#/$defs/nonEmptyUniqueStrings"}}},
    "artifact_kinds": {"type": "object", "minProperties": 1, "additionalProperties": {"$ref": "#/$defs/artifactKind"}},
    "impact_tags": {"$ref": "#/$defs/nonEmptyUniqueIds"},
    "routes": {"type": "object", "minProperties": 1, "additionalProperties": {"$ref": "#/$defs/route"}},
    "node_templates": {"type": "object", "minProperties": 1, "additionalProperties": {"$ref": "#/$defs/nodeTemplate"}},
    "specialists": {"type": "object", "additionalProperties": {"$ref": "#/$defs/specialist"}},
    "limits": {"$ref": "#/$defs/limits"},
    "required_checks": {"type": "object", "minProperties": 1, "additionalProperties": {"$ref": "#/$defs/check"}},
    "role_capabilities": {"type": "object", "minProperties": 1, "additionalProperties": {"type": "array", "uniqueItems": true, "items": {"$ref": "#/$defs/capability"}}},
    "denied_patterns": {"$ref": "#/$defs/nonEmptyUniqueStrings"},
    "reviewer_delegation": {"$ref": "#/$defs/reviewerDelegation"}
  },
  "$defs": {
    "id": {"type": "string", "pattern": "^[A-Za-z0-9][A-Za-z0-9._-]{0,63}$"},
    "version": {"type": "string", "pattern": "^[0-9]+\\.[0-9]+\\.[0-9]+$"},
    "nonEmptyUniqueStrings": {"type": "array", "minItems": 1, "uniqueItems": true, "items": {"type": "string", "minLength": 1}},
    "nonEmptyUniqueIds": {"type": "array", "minItems": 1, "uniqueItems": true, "items": {"$ref": "#/$defs/id"}},
    "artifactKind": {"type": "object", "additionalProperties": false, "required": ["extensions", "max_bytes"], "properties": {"extensions": {"$ref": "#/$defs/nonEmptyUniqueStrings"}, "max_bytes": {"type": "integer", "minimum": 1, "maximum": 4194304}}},
    "route": {"type": "object", "additionalProperties": false, "required": ["entry_node", "design_gates", "delivery_gates", "closure"], "properties": {"entry_node": {"$ref": "#/$defs/id"}, "design_gates": {"type": "boolean"}, "delivery_gates": {"type": "boolean"}, "closure": {"$ref": "#/$defs/id"}}},
    "outputContract": {"type": "object", "additionalProperties": false, "required": ["artifact_kind", "schema_version", "artifact_required"], "properties": {"artifact_kind": {"$ref": "#/$defs/id"}, "schema_version": {"const": 1}, "artifact_required": {"type": "boolean"}, "evidence_required": {"type": "boolean"}, "decision_forbidden": {"type": "boolean"}, "findings_forbidden": {"type": "boolean"}, "decision_values": {"$ref": "#/$defs/nonEmptyUniqueIds"}, "artifact_required_for_decisions": {"$ref": "#/$defs/nonEmptyUniqueIds"}, "evidence_required_for_decisions": {"$ref": "#/$defs/nonEmptyUniqueIds"}}},
    "nodeTemplate": {"type": "object", "additionalProperties": false, "required": ["role", "stages", "mandatory", "max_retries", "output_contract"], "properties": {"role": {"$ref": "#/$defs/id"}, "stages": {"$ref": "#/$defs/nonEmptyUniqueIds"}, "mandatory": {"type": "boolean"}, "max_retries": {"type": "integer", "minimum": 0}, "output_contract": {"$ref": "#/$defs/outputContract"}}},
    "specialist": {"type": "object", "additionalProperties": false, "required": ["node_key", "role", "stages", "mandatory"], "properties": {"node_key": {"$ref": "#/$defs/id"}, "role": {"$ref": "#/$defs/id"}, "stages": {"$ref": "#/$defs/nonEmptyUniqueIds"}, "mandatory": {"type": "boolean"}}},
    "limits": {"type": "object", "additionalProperties": false, "required": ["design_revisions", "delivery_repairs", "inspection", "manifest_bytes", "artifact_bytes"], "properties": {"design_revisions": {"type": "integer", "minimum": 0, "maximum": 3}, "delivery_repairs": {"type": "integer", "minimum": 0, "maximum": 3}, "inspection": {"type": "object", "additionalProperties": false, "required": ["file_reads", "discovery_commands"], "properties": {"file_reads": {"type": "integer", "minimum": 0, "maximum": 12}, "discovery_commands": {"type": "integer", "minimum": 0, "maximum": 8}}}, "manifest_bytes": {"type": "integer", "minimum": 1, "maximum": 262144}, "artifact_bytes": {"type": "integer", "minimum": 1, "maximum": 4194304}, "branch_lease_seconds": {"type": "integer", "minimum": 30, "maximum": 3600}}},
    "check": {"type": "object", "additionalProperties": false, "required": ["command_id", "mandatory"], "properties": {"command_id": {"$ref": "#/$defs/id"}, "mandatory": {"const": true}, "argv": {"type": "array", "minItems": 1, "maxItems": 32, "items": {"type": "string", "minLength": 1, "maxLength": 1024}}, "timeout_seconds": {"type": "integer", "minimum": 1, "maximum": 3600}}},
    "capability": {"type": "object", "additionalProperties": false, "required": ["effect", "action", "target_ref"], "properties": {"effect": {"enum": ["filesystem_read", "filesystem_write", "command", "external_read", "external_write", "destructive", "publish", "deploy"]}, "action": {"$ref": "#/$defs/id"}, "target_ref": {"type": "string", "minLength": 1, "maxLength": 1200}}},
    "reviewerDelegationLimits": {"type": "object", "additionalProperties": false, "required": ["max_depth", "max_children_per_request", "max_children_per_run", "max_request_rounds", "max_weighted_dispatch_cost"], "properties": {"max_depth": {"type": "integer", "minimum": 0, "maximum": 1}, "max_children_per_request": {"type": "integer", "minimum": 0, "maximum": 3}, "max_children_per_run": {"type": "integer", "minimum": 0, "maximum": 6}, "max_request_rounds": {"type": "integer", "minimum": 0, "maximum": 2}, "max_weighted_dispatch_cost": {"type": "integer", "minimum": 0, "maximum": 15}}},
    "reviewerDelegationAssignment": {"type": "object", "additionalProperties": false, "required": ["assignment_id", "role", "model", "reasoning_effort", "review_lens", "prompt_template", "allowed_reason_codes", "allowed_evidence_kinds", "scope_refs", "max_instances", "dispatch_weight"], "properties": {"assignment_id": {"$ref": "#/$defs/id"}, "role": {"enum": ["code_reviewer", "security_reviewer"]}, "model": {"type": "string", "minLength": 1, "maxLength": 128}, "reasoning_effort": {"enum": ["high", "xhigh", "max"]}, "review_lens": {"type": "string", "minLength": 1, "maxLength": 1024}, "prompt_template": {"type": "string", "minLength": 1, "maxLength": 4096}, "allowed_reason_codes": {"type": "array", "uniqueItems": true, "items": {"$ref": "#/$defs/id"}}, "allowed_evidence_kinds": {"type": "array", "uniqueItems": true, "items": {"$ref": "#/$defs/id"}}, "scope_refs": {"type": "array", "uniqueItems": true, "items": {"type": "string", "minLength": 1, "maxLength": 1200}}, "max_instances": {"type": "integer", "minimum": 1, "maximum": 3}, "dispatch_weight": {"enum": [3, 4, 5]}}, "oneOf": [{"properties": {"model": {"const": "gpt-5.6-luna"}, "reasoning_effort": {"const": "max"}, "dispatch_weight": {"const": 3}}}, {"properties": {"model": {"const": "gpt-5.6-sol"}, "reasoning_effort": {"const": "high"}, "dispatch_weight": {"const": 3}}}, {"properties": {"model": {"const": "gpt-5.6-sol"}, "reasoning_effort": {"const": "xhigh"}, "dispatch_weight": {"const": 4}}}, {"properties": {"model": {"const": "gpt-5.6-sol"}, "reasoning_effort": {"const": "max"}, "dispatch_weight": {"const": 5}}}, {"properties": {"model": {"const": "composer-2.5"}, "reasoning_effort": {"const": "high"}, "dispatch_weight": {"const": 3}}}, {"properties": {"model": {"const": "cursor-grok-4.6"}, "reasoning_effort": {"const": "high"}, "dispatch_weight": {"const": 3}}}, {"properties": {"model": {"const": "cursor-grok-4.6"}, "reasoning_effort": {"const": "xhigh"}, "dispatch_weight": {"const": 4}}}, {"properties":{"model":{"const":"gpt-6-astra"},"reasoning_effort":{"const":"high"},"dispatch_weight":{"const":3}}}, {"properties":{"model":{"const":"gpt-6-astra"},"reasoning_effort":{"const":"xhigh"},"dispatch_weight":{"const":4}}}, {"properties":{"model":{"const":"gpt-6-astra"},"reasoning_effort":{"const":"max"},"dispatch_weight":{"const":5}}}]},
    "reviewerDelegation": {"type": "object", "additionalProperties": false, "required": ["limits", "assignments"], "properties": {"limits": {"$ref": "#/$defs/reviewerDelegationLimits"}, "assignments": {"type": "array", "uniqueItems": true, "items": {"$ref": "#/$defs/reviewerDelegationAssignment"}}}}
  }
}
